{
  "schema_version": "1",
  "receipt_id": "rcpt_continue_001",
  "request_id": "req_continue_001",
  "session_id": "sess_stele_001",
  "status": "committed",
  "revision": 4,
  "view_revision": 1,
  "interaction_epoch": 2,
  "action": "continue_story",
  "payload_digest": "sha256:continue-story-v1"
}
